{
  "request": {
    "requestId": "00000000-0000-4000-8000-000000000001",
    "mode": "EXACT_INPUT",
    "sellAssetId": "ETH",
    "buyAssetId": "USDC",
    "amountAtomic": "1000000000000000000000",
    "originChainId": 1,
    "chainIds": [
      1
    ],
    "comparisonScope": "ORIGIN_CHAIN",
    "slippageBps": 50
  },
  "quotes": [
    {
      "quoteId": "00000000-0000-4000-8000-000000000002",
      "mode": "EXACT_INPUT",
      "chainId": 1,
      "providerId": "0x",
      "status": "NO_ROUTE",
      "sellToken": {
        "chainId": 1,
        "kind": "NATIVE",
        "address": null,
        "name": "Ether",
        "symbol": "ETH",
        "decimals": 18,
        "isDemo": false
      },
      "buyToken": {
        "chainId": 1,
        "kind": "ERC20",
        "address": "0xa0b86991c6218b36c1d19d4a2e9eb0ce3606eb48",
        "name": "USD Coin",
        "symbol": "USDC",
        "decimals": 6,
        "isDemo": false
      },
      "sellAmountAtomic": null,
      "buyAmountAtomic": null,
      "minBuyAmountAtomic": null,
      "maxSellAmountAtomic": null,
      "priceImpactBps": null,
      "observedAt": 1791417600,
      "expiresAt": 1791417630,
      "blockNumber": null,
      "fees": {
        "items": [
          {
            "kind": "GAS",
            "amountAtomic": "500000000000000",
            "token": {
              "chainId": 1,
              "kind": "NATIVE",
              "address": null,
              "name": "Ether",
              "symbol": "ETH",
              "decimals": 18,
              "isDemo": false
            },
            "treatment": "ADDITIONAL",
            "provenance": "SYNTHETIC fixture gas estimate"
          }
        ],
        "bridgeCostIncluded": false,
        "approvalCostIncluded": false,
        "gasCoverage": "SWAP_ONLY"
      },
      "sourceNames": [],
      "feeCompleteness": "PARTIAL",
      "rankingBasis": "GROSS_OUTPUT",
      "rankingAmountAtomic": null,
      "rankingToken": null,
      "isHypothetical": false,
      "reasonCode": "INSUFFICIENT_LIQUIDITY"
    }
  ],
  "recommendedQuoteId": null,
  "rankingBasis": "GROSS_OUTPUT",
  "rankingStatus": "NO_AVAILABLE_QUOTES",
  "observedAt": 1791417600,
  "expiresAt": 1791417630,
  "disclosures": [
    "SYNTHETIC data; not a market quote.",
    "Gross output ranking; gas is separate.",
    "Recommendation only; swap execution unavailable."
  ],
  "executionAvailable": false
}
